<?xml version="1.0" encoding="UTF-8"?>
<requete xmlns:xsi="http://www.w3.org/2001/XMLSchema-instance" xmlns="http://mistrals.sedoo.fr/extract/requete" xsi:schemaLocation="http://mistrals.sedoo.fr/extract/requete http://mistrals.sedoo.fr/extract/requete.xsd">
<projet>HyMeX</projet>
  <selection>
  	<periode>
    	<date_min>2013-01-01T00:00:00</date_min>
    	<date_max>2013-09-30T23:59:59</date_max>
    </periode>
    <zone>
    	<lat_min>40</lat_min>
    	<lat_max>55</lat_max>
    	<lon_min>-15</lon_min>
    	<lon_max>30</lon_max>
    </zone>
    <datasets>
    	<!-- 495     <dats_id>592</dats_id>   595   -->
    	 <dats_id>600</dats_id>
    </datasets>    
    <places>
   		<!--place_id>16955</place_id>
    	<place_id>17829</place_id>
    	<place_id>13269</place_id>
    	<place_id>13189</place_id>
    	<place_id>6404</place_id>
    	<place_id>6417</place_id>
    	<place_id>442</place_id>
    	<place_id>10020</place_id>
    	<place_id>12897</place_id>
    	<place_id>10019</place_id>
    	<place_id>8504</place_id>
    	<place_id>8505</place_id>
    	<place_id>11067</place_id>
    	<place_id>11079</place_id>
    	<place_id>13111</place_id>
    	<place_id>13104</place_id>
    	<place_id>12904</place_id>
    	<place_id>12920</place_id>
    	<place_id>10028</place_id-->
    </places>   
  	<variables>
  		<!--var_id>332</var_id>
  		<var_id>52</var_id>
  		<var_id>336</var_id>
  		<var_id>279</var_id>
  		<var_id>205</var_id>
  		<var_id>232</var_id>
  		<var_id>513</var_id>
  		<var_id>484</var_id>
  		<var_id>729</var_id>
  		<var_id>730</var_id>
  		<var_id>731</var_id>
  		<var_id>687</var_id-->
  		<!--var_id>481</var_id>
  		<var_id>232</var_id>
  		<var_id>443</var_id>
  		<var_id>279</var_id>
  		<var_id>205</var_id>
  		<var_id>235</var_id-->
  	</variables>
  </selection>
  <utilisateur>
    <utilisateur_email>guillaume.brissebrat@obs-mip.fr</utilisateur_email>
    <utilisateur_nom>Guillaume Brissebrat</utilisateur_nom>    
    <utilisateur_institute>Sedoo</utilisateur_institute>
  </utilisateur>
  <options>
    <format>netcdf</format>
    <format_version>timeSeries</format_version>
    <compression>gzip</compression>
    <valeurs_absentes>-9999.9</valeurs_absentes>
    <separateur>;</separateur>
    <valeur_flag>true</valeur_flag>
    <valeur_delta>true</valeur_delta>
  </options>
</requete>