<?xml version="1.0" encoding="UTF-8"?>
<requete xmlns:xsi="http://www.w3.org/2001/XMLSchema-instance" xmlns="http://mistrals.sedoo.fr/extract/requete" xsi:schemaLocation="http://mistrals.sedoo.fr/extract/requete http://mistrals.sedoo.fr/extract/requete.xsd">
<projet>HyMeX</projet>
  <selection>
  	<periode>
    	<!--date_min>1988-10-01T00:00:00</date_min>
    	<date_max>1988-10-31T23:59:00</date_max-->
    </periode>
    <zone>
    	<lat_min>20</lat_min>
    	<lat_max>50</lat_max>
    	<lon_min>0</lon_min>
    	<lon_max>20</lon_max>
    </zone>
    <datasets>
    	 <dats_id>626</dats_id>
    	 <dats_id>627</dats_id>
    </datasets>    
    <places>
    	<place_id>1433</place_id>
    	<place_id>885</place_id>
    	<place_id>4794</place_id>
    	<place_id>10468</place_id>
    	<place_id>939</place_id>
    </places>
  	<variables>
  		<var_id>332</var_id>
  		<var_id>481</var_id>
  		<!--var_id>232</var_id>
  		<var_id>443</var_id>
  		<var_id>52</var_id>
  		<var_id>279</var_id>
  		<var_id>205</var_id>
  		<var_id>235</var_id-->
  	</variables>
  </selection>
  <utilisateur>
    <utilisateur_email>guillaume.brissebrat@obs-mip.fr</utilisateur_email>
    <utilisateur_nom>Guillaume Brissebrat</utilisateur_nom>    
    <utilisateur_institute>Sedoo</utilisateur_institute>
  </utilisateur>
  <options>
    <format>ames</format>
    <format_version>1001</format_version>
    <compression>zip</compression>
    <valeurs_absentes>-9999.9</valeurs_absentes>
    <separateur>;</separateur>
    <valeur_flag>true</valeur_flag>
    <valeur_delta>true</valeur_delta>
  </options>
</requete>