<?xml version="1.0" encoding="UTF-8"?>
<requete xmlns:xsi="http://www.w3.org/2001/XMLSchema-instance" xmlns="http://sedoo.fr/extract/requete" xsi:schemaLocation="http://sedoo.fr/extract/requete requete.xsd ">
	<projet>#MainProject</projet>
	<selection>
		<periode />
		<zone />
		<datasets />
		<places />
		<variables />
	</selection>
	<utilisateur>
		<utilisateur_email />
		<utilisateur_nom />
		<utilisateur_institute />
	</utilisateur>
	<options>
		<format />
		<format_version />
		<compression />
		<valeurs_absentes>-9999.9</valeurs_absentes>
		<separateur>;</separateur>
		<valeur_flag>false</valeur_flag>
		<valeur_delta>false</valeur_delta>
	</options>
</requete>
